title, author, publisher, date_published, ratings, pages, isbn, language, genres
AIRPORT PLANNING AND MANAGEMENT 6/E: Edition 6,Seth Young,McGraw Hill Professional,Mar 8| 2011,4.1,608,9780071750233,English,Technology & Engineering / Civil / General
Programmable Logic Controllers: Industrial Control,Khaled Kamel,McGraw Hill Professional,Jul 22| 2013,4.1,432,9780071810470,English,Technology & Engineering / Civil / General
Mathematical Modelling,Seppo Pohjolainen,Springer,Jul 14| 2016,4.7,242,9783319278360,English,Computers / Computer Science
Numerical Linear Algebra,Lloyd N. Trefethen,SIAM,Jan 1| 1997,4.0,373,9780898719574,English,Mathematics / Algebra / General
Five Alarm Leadership: From the Firehouse to the Fireground,Rick Lasky,Fire Engineering Books,2013,4.7,234,9781593702342,English,Education / Decision-Making & Problem Solving
Pride & Ownership: A Firefighter's Love of the Job,Rick Lasky,PennWell Books,2006,4.5,302,9781593700782,English,Business & Economics / Leadership
The Definitive Guide to ARM® Cortex®-M3 and Cortex®-M4 Processors: Edition 3,Joseph Yiu,Newnes,Oct 6| 2013,4.7,864,9780124079182,English,Computers / Microprocessors
Biomaterials Science: An Introduction to Materials in Medicine| Edition 3,Buddy D. Ratner,Academic Press,Dec 31| 2012,3.8,1573,9780080877808,English,Medical / Instruments & Supplies
Machinery Directive & Harmonised Standards: Machinery Directive 2006/43/EC & HSA Harmonised Standards database,Dr. Eng. Marco Maccarelli,Certifico S.r.l.,Dec 21| 2020,5.0,200,9788898550241,English,Technology & Engineering / Industrial Technology
Manufacturing Planning and Control for Supply Chain Management,F. Robert Jacobs,McGraw Hill Professional,May 6| 2011,4.0,576,9780071750325,English,Technology & Engineering / Civil / General
Surface Water-Quality Modeling,Steven C. Chapra,Waveland Press,Dec 17| 2008,4.4,844,9781478608301,English,Technology & Engineering / Environmental / Water Supply
CNC Programming using Fanuc Custom Macro B,S. K Sinha,McGraw Hill Professional,Jun 22| 2010,3.6,288,9780071713337,English,Technology & Engineering / Civil / General
Crew Resource Management: Edition 2,Earl L. Wiener,Academic Press,Jan 20| 2010,3.8,625,9780080959009,English,Psychology / Applied Psychology
Wills' Mineral Processing Technology: An Introduction to the Practical Aspects of Ore Treatment and Mineral Recovery| Edition 7,Barry A. Wills,Elsevier,Apr 18| 2011,4.8,456,9780080479477,English,Technology & Engineering / Materials Science / General
Fireground Strategies,Anthony Avillo,Fire Engineering Books,2008,4.0,698,9781593701598,English,Technology & Engineering / Fire Science
Learning OpenCV 3: Computer Vision in C++ with the OpenCV Library,Adrian Kaehler,"O'Reilly Media| Inc.",Dec 14| 2016,5.0,1024,9781491938003,English,Computers / Computer Vision & Pattern Recognition
Essentials of Chemical Reaction Engineering: Edition 2,H. Scott Fogler,Prentice Hall,Oct 26| 2017,4.0,816,9780134664538,English,Technology & Engineering / Chemical & Biochemical
Collapse of Burning Buildings| 2nd Edition: A Guide to Fireground Safety,Vincent Dunn,PennWell Books,2010,4.7,347,9781593702335,English,Technology & Engineering / Fire Science
Signal and Power Integrity - Simplified: Signa Integ Simpl Secon E_2| Edition 2,Eric Bogatin,Pearson Education,Jul 13| 2009,5.0,792,9780137035038,English,Technology & Engineering / Electronics / General
Materials Science and Engineering: An Introduction| Edition 10,William D. Callister| Jr.,Wiley Global Education,Feb 23| 2018,1.0,980,9781119405436,English,Science / Chemistry / General
Introduction to Infrastructure: An Introduction to Civil and Environmental Engineering: An Introduction to Civil and Environmental Engineering,Michael R. Penn,Wiley Global Education,Nov 11| 2011,0,425,9781118213339,English,Technology & Engineering / Civil / General
Confectionery Science and Technology,Richard W. Hartel,Springer,Oct 9| 2017,0,536,9783319617428,English,Technology & Engineering / Chemical & Biochemical
A Practical Guide to SysML: The Systems Modeling Language| Edition 3,Sanford Friedenthal,Morgan Kaufmann,Oct 23| 2014,4.0,630,9780128008003,English,Computers / Programming / Object Oriented
Disaster Planning and Control,William Michael Kramer,Fire Engineering Books,2009,4.0,462,9781593701895,English,Political Science / Public Affairs & Administration
Handbook of Liquefied Natural Gas,Saeid Mokhatab,Gulf Professional Publishing,Oct 15| 2013,4.8,624,9780124046450,English,Business & Economics / Industries / Natural Resource Extraction
Understanding Digital Signal Processing: Unders Digita Signal Proces_3| Edition 3,Richard G. Lyons,Pearson Education,Nov 1| 2010,5.0,99998,9780137028528,English,Technology & Engineering / Signals & Signal Processing
Pocket Guide to Flanges| Fittings| and Piping Data: Edition 3,R. R. Lee,Elsevier,Nov 3| 1999,4.0,160,9780080514154,English,Technology & Engineering / Structural
OLED Display Fundamentals and Applications: Edition 2,Takatoshi Tsujimura,John Wiley & Sons,Mar 2| 2017,5.0,320,9781119187486,English,Technology & Engineering / Electrical
Surveying| 6th Edition,Jack C. McCormac,Wiley Global Education,Apr 2| 2012,5.0,379,9781118213384,English,Technology & Engineering / Civil / General
WSUD Engineering Procedures: Stormwater: Stormwater,Melbourne Water|,CSIRO PUBLISHING,Jun 16| 2005,5.0,304,9780643099890,English,Nature / Natural Resources
Reeds Vol 2: Applied Mechanics for Marine Engineers,Paul Anthony Russell,Bloomsbury Publishing,Mar 9| 2015,4.0,640,9781472910578,English,Science / Mechanics / General
Introduction to Electrodynamics: Edition 4,David J. Griffiths,Cambridge University Press,Jun 29| 2017,5.0,624,9781108357142,English,Science / Mechanics / General
Fire Department Strategic Planning: Creating Future Excellence,Mark Wallace,PennWell Books,2006,2.5,343,9781593700034,English,Business & Economics / Strategic Planning
Sound Systems: Design and Optimization: Modern Techniques and Tools for Sound System Design and Alignment| Edition 3,Bob McCarthy,CRC Press,Feb 26| 2016,5.0,580,9781317911081,English,Technology & Engineering / Acoustics & Sound
Commercial Refrigeration for Air Conditioning Technicians: Edition 3,Dick Wirz,Cengage Learning,Jan 27| 2017,0,432,9781337514699,English,Technology & Engineering / Construction / Heating| Ventilation & Air Conditioning
Practical Troubleshooting of Electrical Equipment and Control Circuits,Mark Brown,Elsevier,Oct 21| 2004,3.8,248,9780080480282,English,Technology & Engineering / Electrical
Fire Service Hydraulics and Pump Operations,Paul Spurgeon,Fire Engineering Books,2012,5.0,229,9781593702854,English,Technology & Engineering / Fire Science
Digital Design and Computer Architecture: Edition 2,David Harris,Elsevier,Aug 24| 2012,4.1,712,9780123978165,English,Computers / Computer Engineering
Essentials of Chemical Reaction Engineering: Essenti Chemica Reactio Engi,H. Scott Fogler,Pearson Education,Nov 2| 2010,4.3,99998,9780132317177,English,Technology & Engineering / Chemical & Biochemical
Circuit Design: Know It All,Darren Ashby,Newnes,Apr 19| 2011,3.8,1248,9780080949659,English,Technology & Engineering / Electronics / Circuits / General
Physics and Technology for Future Presidents: An Introduction to the Essential Physics Every World Leader Needs to Know,Richard A. Muller,Princeton University Press,Apr 12| 2010,3.8,536,9781400835317,English,Science / Physics / General
Process Dynamics and Control| 4th Edition: Edition 4,Dale E. Seborg,Wiley Global Education,Nov 16| 2016,3.7,512,9781119298489,English,Technology & Engineering / Chemical & Biochemical
Mechanics of Materials Laboratory Course,Ghatu Subhash,Morgan & Claypool Publishers,Apr 30| 2018,5.0,226,9781681733340,English,Science / Mechanics / Solids
Mathematical Techniques in Multisensor Data Fusion,David Lee Hall,Artech House,2004,0,449,9781580533355,English,Computers / General
Ice Cream: Edition 7,H Douglas Goff,Springer Science & Business Media,Jan 17| 2013,4.2,462,9781461460961,English,Science / Chemistry / Organic
Computer Organization and Design RISC-V Edition: The Hardware Software Interface,David A. Patterson,Morgan Kaufmann,May 12| 2017,5.0,696,9780128122761,English,Computers / Computer Engineering
Ultraviolet Germicidal Irradiation Handbook: UVGI for Air and Surface Disinfection,Wladyslaw Kowalski,Springer Science & Business Media,Jan 12| 2010,5.0,501,9783642019999,English,Medical / General
Fundamentals of Fire Fighter Skills: Edition 3,Iafc,Jones & Bartlett Publishers,Dec 27| 2012,3.4,1188,9781449666507,English,Technology & Engineering / Fire Science
Residential Construction Management: Managing According to the Project Lifecycle,Joseph A. Griffin,J. Ross Publishing,Mar 15| 2010,0,288,9781604270228,English,Architecture / Project Management
The Designer's Guide to VHDL,Peter J. Ashenden,Morgan Kaufmann,Oct 7| 2010,5.0,936,9780080568850,English,Computers / Programming Languages / General
